{
  "schemaVersion": "0.2",
  "context": {
    "datasetRef": "fixture:dataset-v1",
    "registryRef": "fixture:registry-v1",
    "readerPolicyRef": "fixture:visible-only-v1",
    "executionProfileRef": "fixture:reference-v1"
  },
  "queryIdentity": "fixture:result-identity",
  "evaluation": "complete",
  "rows": [
    {
      "entityId": "fixture:p000",
      "witnesses": [
        {
          "criterionPath": "/selection/filters/0",
          "kind": "assertion",
          "assertionRefs": [
            "fixture:a1"
          ],
          "sourceRefs": [
            "fixture:source1"
          ]
        },
        {
          "criterionPath": "/selection/filters/1",
          "kind": "derivation",
          "assertionRefs": [
            "fixture:a2"
          ],
          "sourceRefs": [
            "fixture:source1"
          ],
          "ruleRef": "fixture:lifespan-rule-v1"
        }
      ],
      "witnessesComplete": true
    }
  ],
  "assertions": [
    {
      "assertionRef": "fixture:a1",
      "upstreamContractRef": "fixture:assertion-v1",
      "payload": {
        "subject": "fixture:p000",
        "predicate": "field_of_work",
        "object": "fixture:philosophy",
        "assertion_status": "sourced",
        "source_refs": [
          "fixture:source1"
        ]
      }
    },
    {
      "assertionRef": "fixture:a2",
      "upstreamContractRef": "fixture:assertion-v1",
      "payload": {
        "subject": "fixture:p000",
        "predicate": "lifespan",
        "object": [
          350,
          430
        ],
        "assertion_status": "sourced",
        "source_refs": [
          "fixture:source1"
        ]
      }
    }
  ],
  "nextCursor": null,
  "total": {
    "kind": "exact",
    "value": 1
  }
}
